"siteID","Sites","Description","Soil.characteristics","Products","Economic.interests","Other.services","Hypothetical.combinations","Link","lat","lon"
1,"","In Portugal, the main agroforestry system is a traditional system called Montado. It is characterized by low density trees combined with agriculture or pastoral activities. The main tree species encountered in the Montado are cork oak (Quercus suber L) and/or holm oak (Quercus rotundifolia L). Mixed stands with a combination of these species are also common. Cork oak based Montado areas are included in the Portuguese National Forest Inventory (NFI) as part of the cork oak and holm oak forest area, which occupies 736,775 ha and 331,179 ha respectively (AFN, 2010). There are substantial variations in the management of the understorey ranging from forest systems (cork in cork oak systems) to agrosilvopastoral systems (cork, sweet acorns, animal and/or crop production together). The majority of the Montado area is in the south-east of Portugal, although there are some areas in the north of the country.

Agroforestry also exists in North and Central Portugal in the form of natural pastures where trees are included as hedges, borders or riparian forest lines (collectively known as ""Lameiros""), and there are considered to be about 41400 ha of low density stands of sweet chestnut (Castanea sativa) called ""Soutos e castinçais"".","","","","","","Montado in Portugal - Agforward - en",NA,NA
2,"Southern Portugal","Oaks (Cork oak or holm oak) with a mixing trend with stone pine at low density (30-70 trees ha-1) and low crown cover percentage (30-50%), in order to combine cork production with agriculture or grazing (natural or improved pasture or sown biodiverse pastures).","Arenosols; leptosols; cambisols.","From trees: cork, firewood, acorns, fodder From undercover: crops, meat, milk, cheese, wool, honey, mushrooms","Around 18000 jobs related to the montado. Portugal is the first world cork producer (around 140.000 tons/year, 54% of the world production) and the cork industry represents around 3% of the national GDP.","Soil protection, tourism, hunting, carbon sequestration, water cycle regulation, biodiversity, fire prevention (shrub control), and organic Matter improvement.","Q. suber + cereal rotation (wheat-wheat-fallow). Q. suber + permanent natural pastures + (Cattle, sheep, goat, pig, turkey). Q. suber + permanent improved pastures + (Cattle, sheep, goat, pig, turkey). Q. suber + sown biodiverse pastures. Same combinations with Q. rotundifolia","Working title: AGroFORestry that Will Advance Rural Development (Agforward)",NA,NA
3,"Throughout the UK","Wood pasture and parklands in the UK comprise open-grown (often pollarded) trees, grazing livestock, and typically an understory of grassland. The oldest wood pastures and parklands are valued for their veteran trees which have high landscape value as well as hosting a range of epiphytes and micro-organisms.","A range of soil types including cambisols and luvisols (including planosols)","From trees: firewood 
From undercover: meat ","UK conservation groups are particularly interested in the maintenance of wood 
pastures and parklands. ","Tourism and recreational opportunities, carbon sequestration, water cycle regulation, 
biodiversity, green space around cities.","","Working title: AGroFORestry that Will Advance Rural Development (Agforward)",NA,NA
4,"Xeromero, prefecture of Aetoloakarnania, W. Greece 
Kea, Aegean island, Greece; Alexandroupoli, NE Greece; Rethimno, Crete ","Agroforestry and specifically silvopastoralism is a traditional land use system in 
Xeromero, Aetoloakarnania, Western Greece where livestock breeders use the valonia 
oak forest for grazing whilst collecting acorns from the oaks. In this way they ensured a 
steady and enhanced economic return each year irrespectively of weather conditions. 
The forest is characterized by the dominance of old valonia oak trees. The combined 
use of valonia oak forest and grazing is gradually being abandoned, sometimes being 
replaced with monocultures of olive groves.  ","Lithosols – Chromic Luvisols","From trees: firewood, acorns, fodder 
From understorey: meat, dairy, cheese, wool, honey, mushrooms ","","Soil protection, tourism, hunting, carbon sequestration, water cycle regulation, 
biodiversity, fire prevention (shrub control), and organic Matter improvement. ","Q.ithaburensis + permanent natural pastures + (sheep, goat) ","Working title: AGroFORestry that Will Advance Rural Development (Agforward)",NA,NA
5,"North-eastern Germany","Windbreaks or shelterbelts consist of tall and narrow trees and shrubs. The trees are usually a combination of fast and slow growing trees. The windbreak has the function to prevent soil erosion. Windbreaks have the best protection when they are between 40 and 50% solid.","Luvisols, podzoluvisols, gleysols, cambisols, podzols","From trees: Wood products, biomass feedstocks 
From undercover: crops ","The crops can be used for a gasifier and the biomass for a combined heat and power plant","Soil protection, C-sequestration, water quality, biodiversity, soil fertility/Organic Matter","Populus spp. + cereal, maize, alfalfa rotation 
Salix spp. . + cereal, maize, alfalfa rotation ","Working title: AGroFORestry that Will Advance Rural Development (Agforward)",NA,NA
6,"Mainly in north and interior regions of Portugal, associated with agricultural land  
Scattered occurrences in other regions of the country","Bordure tree include trees with a diverse of usages and special arranges: randomly or in hedges, borders and/or in riparian forests lines. These areas are frequently designated as Lameiros: areas with bordures trees associated to natural pastures or improved pastures for animal grazing. These trees, traditionally built for field demarcation, are important for local fire wood consumption, animal fodder, soil protection from water or wind erosion (Pereira et al. 2004), and pasture improvement (Pereira et al. 2005). These areas, although characterized by deep and fertile soils, have been suffering abandonment as grazing is reduced in these regions (INE 2014). In turn, the abandonment of grazing rapidly changes the composition of the herbaceous stratus composition, increasing the presence of species with low pasture interest (Amaro 2009). In addition, the trees are frequently removed thereby decreasing biodiversity. It is difficult to assess the area of such systems due the lack of official inventory data.","Depth: Deep soils 
Texture: medium  
Others: Prefers mesotrophic soils ","Biomass for fire wood and forage for animal","Forage for animal consumption especially in Summer period","Improve pastures quality, water regulation, soil erosion protection, biodiversity, landscape","","Working title: AGroFORestry that Will Advance Rural Development (Agforward)",NA,NA
7,"England","Organic silvoarable systems with top fruit (apples, pears) and/or timber species, and arable crops (but sometimes vegetables) in the alleys. Alleys typically 10-12 m wide.","Variable","Trees: Top fruit (apples, pears, plums), timber. 
Agriculture: cereals, vegetables.","Currently very small both at a national scale and on a farm scale. Enterprise 
diversification is a key economic aim for the producers. ","Biodiversity support including for functional biodiversity such as pollinators and natural 
pest control; soil protection (wind erosion, soil fertility, soil structure); shelter for crops ","Mixed timber and apple with cereals (wheat, oats, barley). 
Mixed timber and apple with potatoes; Mixed timber and apple with legume ley. 
Apples and vegetables. ","Working title: AGroFORestry that Will Advance Rural Development (Agforward)",NA,NA
8,"4313 Möhlin (north-western Switzerland)","The parcel is located in the canton of Aargau and is located on an organic farm (BioSuisse) with a total area of 16 hectares. On the agroforestry plot there are a total of 80 trees. The cherry trees (varieties Morina, Coraline and Agate) were planted in October 2009 and 2010. In the tree rows shrubs such as rosehip (Rosa rugosa), sea buckthorn (sanddorn; Hippophae sp.) and cornelian cherry (Cornus mas) are planted to produce wild berry juice. Various vegetables are the main intercrop. The farmer primarily focuses on the environmental performance of its agroforestry plot. An additional motivation for the planting of trees was the vulnerability of the area to erosion, which is why the tree rows were aligned accordingly. For planting the trees he has teamed up with the local environment and Bird Protection Society and BirdLife Switzerland. He also signed a long-term contract with the Canton on ecological direct payments.","Luvisol, silty loam with slight humus content, skeleton free; detailed soil profile available.","Various vegetables, berries, cherries","Vegetables, fruits and berries (direct marketing); direct payments for biodiversity","Landscape scenery, biodiversity, erosion control","","Working title: AGroFORestry that Will Advance Rural Development (Agforward)",47.5592,7.8433
9,"Southern France – Hérault Department","Different tree species, planted in 1995, associated with cereal. Trees in row (13 m x 8 m). The main culture is winter durum wheat in rotation with winter protein pea. Sole crop and forestry controls are available. No block design, but large plots are compared. Tree growth and crop yield are monitored each year since the beginning. Besides the three main tree species (see below), many other tree species are included in an agroforestry arboretum (Prunus avium, Fraxinus angustifolia, Pyrus communis, Acer platanoides).","Silty deep alluvial calcareous fluvisol (25 % clay and 60 % silt). Presence of a water table within reach of the roots of the trees","From trees : timber wood when they are big enough (poplar harvested in 2015) 
From crop : grain and wheat straw ","Quality wood, growing faster than in a forestry system – High protein content wheat ","Tourism: public domain with many walkers, carbon sequestration, biodiversity 
improvement (i.e. bats and birds), hunting, water cycle regulation, fire prevention (shrub 
control), organic matter improvement. ","Hybrid walnut / cereals","Working title: AGroFORestry that Will Advance Rural Development (Agforward)",NA,NA
10,"Herefordshire, England; Loughgall, Northern Ireland; UK","Cider apple (Malus domestica) trees grown in rows of up to c.600 trees/ha (bush orchards) or widely spaces tree arranged on a grid of up to","Cambisols, Luvisols (Herefordshire)","Apples for cider crop, sheep","Apples for cider crop, sheep, saving in mowing costs, additional expense of animal management","","","Working title: AGroFORestry that Will Advance Rural Development (Agforward)",NA,NA
11,"Castel Ritaldi, Perugia, Italy.","Olive trees (Olea europaea) is growing in rows of up to 1670 trees/ha. The asparagus plants are established only along the tree rows to allow the management practices, with density of 4950 plants/ha. The olive/asparagus rows are 4 meter spaced with a grass understorey available for poultry grazing.","Clayey soil (Fine texture)","Olive for oil production, asparagus for edible spears, and chicken meat","Since wild asparagus grows naturally in abandoned olive orchards, once established is a perennial low maintenance crop. The market for its spears is already established, with two to four times the price of cultivate (Benincasa et al. 2007).","Poultry grazing as a pest and weed control and to reduce the use of fertilizer","Olive orchard and asparagus","Working title: AGroFORestry that Will Advance Rural Development (Agforward)",42.8239,12.6725
12,"Mostly in coastal areas around the country and in the inland of west and south Greece (Epirus, Aitoloakarnania, Peloponnese, Crete and in most islands of Ionian and Aegean sea).","The combination of olive orchards with arable crops (cereals) in the same field is a traditional land use system in Greece. The combination of olives and cereals can stabilize the economic return in the context of variable weather conditions.","Luvisols","From trees: Olives, olive oil 
From understory: cereal crops, hay ","","Soil protection, tourism, hunting, carbon sequestration, water cycle regulation, biodiversity, fire 
prevention (shrub control), and organic matter improvement.","Olives with cereals 
Olives with a mixture of cereals and legumes","Working title: AGroFORestry that Will Advance Rural Development (Agforward)",NA,NA
13,"Mostly in Macedonia, N. Greece and Central Greece but throughout Greece in small scale.","Combination of olive orchards with legumes and aromatic plants in Greece.","Lithosols – Chromic Luvisols","From trees: Olives, olive oil, 
From undercover: vegetables","","Soil protection, tourism, hunting, carbon sequestration, water cycle regulation, 
biodiversity, fire prevention (shrub control), and organic matter improvement. ","Olives with legumes 
Olives with aromatic plants ","Working title: AGroFORestry that Will Advance Rural Development (Agforward)",NA,NA
14,"throughout Spain","Spain has a shortage of quality wood. In the last decade, hardwood plantations have substantially increased in many Spanish regions. In order to grow trees for high quality timber in short rotations, an intensive management, based on high levels of energy consumption and inputs, has been adopted, with high economic and environmental costs. The control of competing herbaceous vegetation and fertilization are two of the most controversial management practices.","Cambisols","High quality timber, meat","","Trees increase carbon storage. 
Trees in silvopastoral systems develop deeper root systems that reduce nitrate leaching. 
This system allow to explore new possibilities for sustainable development of farming and 
agricultural districts, where annual livestock production within the parameters of current 
animal welfare can be compatible with the medium-long term hardwood timber 
production, with great current and future demand, developing an environmentally 
efficient production system. ","Legume sowing vs. grass strata (thereafter Fertilized Walnut) 
Grazing vs. ploughing or mowing (thereafter Grazed Walnut) ","Working title: AGroFORestry that Will Advance Rural Development (Agforward)",NA,NA
15,"Mostly in Western, Central and South Greece.","Citrus groves of orange, tangerine and lemon trees are a characteristic land use system in Chania, Crete, Greece. In the past, farmers used to cultivate crops in between citrus trees after pollarding them to change varieties. They also used cypress trees as hedgerows to protect citrus trees from winds (as windbreaks). However nowadays they prefer to cut the cypress trees from the hedgerows or to uproot citrus trees and switch to avocado monoculture for higher profit. Only a few farmers still practice agroforestry as citrus trees with intercrops ensuring a steady economic return every year irrespectively of weather conditions or other type of hazards until tree crown fully develops to exclude any form of intercropping. Most of the intercrops are vegetables. After crown development intercrops are replaced by chickens grazing.","Lithosols – Chromic Luvisols","From trees: Oranges, orange juice, 
From undercover: vegetables ","Locals sell oranges in the various hotels during the summer season. It is of great interest 
however farmers are desperate due to the low product price. However it is a beautiful 
site with cultural value. ","Soil protection, tourism, hunting, carbon sequestration, water cycle regulation, 
biodiversity, fire prevention (shrub control), and organic Matter improvement.","Orange with aromatic plants","Working title: AGroFORestry that Will Advance Rural Development (Agforward)",NA,NA
16,"Trás-os-Montes region (north interior Portugal) 
Mountain regions ","These areas include low tree density stands of Castanea sativa species, on average 89 trees per hectare according to AFN (2010), managed for chestnut or high quality wood production in association to permanent pastures (natural or improved) for animal consumption. These areas are also frequently characterized by mixed stands with Quercus pyrenaica trees.","For fruit production:  
Texture: sandy soils (light, fresh), well drained  
Depth: deep soils 
Lithology: Granites, schist, gneisses 
For wood production: 
The has for fruit production (above) but also viable in more shallow soils, in mountain 
areas presenting some erosion  
Other characteristics: 
Calcifuge species; needs soils with medium to high levels of organic matter; not suitable 
for heavy texture soils ","Fruit, wood, firewood (local consumption), direct and indirect animal products","Fruit, wood, direct and indirect animal products","Tourism","1 - Fruit production and sheep grazing  
2 – Wood production and sheep grazing ","Working title: AGroFORestry that Will Advance Rural Development (Agforward)",NA,NA
17,"6210 Sursee (central Switzerland)","The plot is located in the canton of Lucerne, central Switzerland. The farm has an area of approximately 50 hectares. In 2009, 545 apple trees (varieties Boskoop and Spartan) were planted. The intermediate cultures consist of winter wheat, strawberries and sown flower strips. Since the farmer had to give up almost 15 hectares of his farmland for construction, the intensification of agricultural production was a primary goal. The apples should be marketed as a cider fruit. By integrating the sown flower strips ecological direct payments with premiums for eco-quality also can be obtained. Maximizing the subsidies is an additional objective.","Eutric cambisol, sandy loam with slight gley characteristics; detailed soil profile available.","Strawberries for fresh marketing, arable crops, apple for juice production","Crops; apple for juice; direct payments for biodiversity","Landscape scenery, biodiversity","Silvo-arable system with fruit trees (challenge for modelling apple!), berries (another challenge), but otherwise a classical rotation.","Working title: AGroFORestry that Will Advance Rural Development (Agforward)",47.1708,8.1108
18,"CH-4463 Buus (north-western Switzerland)","This is an individual plot planted by a pioneer farmer. It is located in the canton of Basel-Country on a farm with a total area of 20 hectares. In March 2011, 52 Aspen (Populus tremula) were planted. The area between the tree rows was first managed as grassland, is now intercropped with rye, corn and sorghum. The wood of the aspens should be harvested in 30 to 35 years as energy wood.","Calcareous cambisol, slight humus content, clay loam, skeleton rich, moderately deep; detailed soil profile available. 5% inclination","Rye, silage maize for fodder; energy wood","Fodder production for suckler cows; direct payments for biodiversity","CO2 neutral energy production, biodiversity, landscape scenery","“Classical” silvo-arable system with 35 year rotation; unique for Switzerland; CO2 balance would be of specific interest","Working title: AGroFORestry that Will Advance Rural Development (Agforward)",47.5069,7.8644
19,"England","Organic and conventional silvoarable systems with top fruit (apples, pears) and/or short rotation coppice for bioenergy, and arable crops in the alleys. Alleys typically 12 to 24 m wide.","Variable","Trees: Top fruit (apples, pears, plums), woodchip for bioenergy 
Agriculture: cereals ","Currently very small both at a national scale and on a farm scale. Enterprise diversification is a key economic aim for the producers.","Biodiversity support including for functional biodiversity such as pollinators and natural pest control; soil protection (wind erosion, soil fertility, soil structure); shelter for crops","Apple with cereals (wheat, oats, barley) 
Apple with legume ley 
Short Rotation Coppice with cereals 
Short Rotation Coppice with legume ley","Working title: AGroFORestry that Will Advance Rural Development (Agforward)",NA,NA
20,"North-eastern Germany","Alley cropping is a method of planting in which rows of trees are interspersed with rows of crops, improving the soil and providing nutrients, particularly nitrogen, to the crops. The tree rows have the function to prevent soil erosion and create a microclimate for crops.","Cambisols, potzols, gleysols, luvisols, histosols","From trees: wood products, biomass feedstocks 
From undercover: crops ","Number of jobs? 
The crops can be used for a gasifier and the biomass for a combined heat and 
power plant ","Soil protection, C-sequestration, water quality, biodiversity, soil fertility/organic Matter","Populus spp. + cereal, maize, alfalfa rotation 
Robinia pseudoacacia . + cereal, maize, alfalfa rotation","Working title: AGroFORestry that Will Advance Rural Development (Agforward)",NA,NA
21,"Italy, Po Valley, plain and hilly areas of peninsular Italy","Poplar hybrids and species has been intensively managed in Italy for timber production mostly in monoculture plantations, but often in intercropping systems (intercropping of arable crops in between young tree rows) and in linear plantations along field edges, drainage canals and streams. Poplar cultivation, in all the above cultivation models, is currently declining for stagnating domestic timber market. Urgent environmental concerns connected to Global Changes (Carbon sequestration, bioenergy, soil erosion control) should open new prospective for poplar silvoarable systems and linear plantations, combining local bioenergy production with food security and environmental amelioration, such us phytoremediation.","Alluvial soils","From trees: timber (plywood, pallets, wooden fruit boxes), bioenergy; 
From undercover: crops, fodder. ","Traditionally poplar plantations have produced 50% of the domestic timber production in 
Italy, with a declining trend because of the imports competition. Forest certification and 
local bioenergy production could reverse the negative trend. Furthermore, new grants 
(from Rural Development Plans) for farmers establishing new silvoarable systems could be a 
new opportunity for implementing poplar based agroforestry. ","Soil and water protection, carbon sequestration, biodiversity, phytoremediation.","Hybrid poplar linear plantation + corn/wheat 
Hybrid poplars silvoarable system+corn/wheat ","Working title: AGroFORestry that Will Advance Rural Development (Agforward)",NA,NA
22,"Mostly in northern Greece (Macedonia and Thrace).","Agroforestry is a traditional land use system in Voio in which farmers used to combine agricultural production with high value tree species in the same plot. In this way they ensured a steady economic return every year irrespectively of weather conditions or other type of hazards. The area is characterized by fast growing species (poplars) and walnuts at the edges combined with dry beans, cereals and pastures.","Lithosols – Campisols","From trees: timber and nuts 
From understory: cereal crops and beans ","","Soil protection, tourism, hunting, carbon sequestration, water cycle regulation, biodiversity, fire prevention (shrub control), and organic Matter improvement.","","Working title: AGroFORestry that Will Advance Rural Development (Agforward)",NA,NA
23,"Galicia (NW Spain)","Silvoarable systems established with Juglans clone + corn and Prunus avium L. + corn at different densities of plantation and with trees of different age in Spain. An ad-doc experimental plot is being established by a farmer in Portugal under his intensive managed pivot irrigated maize plots. The interest of the innovation is to increase the marginal land around the corners, where the pivot irrigation does not reach. The assessment would estimate the yield of the trees which seem to progress at a potential yield. Different species were planted, including black walnuts and wild cherry.","Humic cambisol","From Trees: timber and fodder  
From undercover: cereals ","Growing high quality trees in association with arable crops may improve the sustainability of farming systems, diversify farmers’ incomes and provide new products to the wood industry","Soil protection, novel landscapes of high value, carbon sequestration, water cycle regulation, organic matter improvement","Prunus avium L. + corn 
Juglans clon + corn 
Juglans clon + wheat, barley or triticale ","Working title: AGroFORestry that Will Advance Rural Development (Agforward)",42.8782,-8.5445
24,"Central Portugal","Silvoarable systems established with Juglans clone + corn and Prunus avium L. + corn at different densities of plantation and with trees of different age in Spain. An ad-doc experimental plot is being established by a farmer in Portugal under his intensive managed pivot irrigated maize plots. The interest of the innovation is to increase the marginal land around the corners, where the pivot irrigation does not reach. The assessment would estimate the yield of the trees which seem to progress at a potential yield. Different species were planted, including black walnuts and wild cherry.","Humic cambisol","From Trees: timber and fodder  
From undercover: cereals ","Growing high quality trees in association with arable crops may improve the sustainability of farming systems, diversify farmers’ incomes and provide new products to the wood industry","Soil protection, novel landscapes of high value, carbon sequestration, water cycle regulation, organic matter improvement","Prunus avium L. + corn 
Juglans clon + corn 
Juglans clon + wheat, barley or triticale ","Working title: AGroFORestry that Will Advance Rural Development (Agforward)",NA,NA
